url,title,description
http://www.zhihu.com/topic/21012856/hot,世间始终你好（书籍）,"自姜铭去年回西大任教以来，还没遇到过这么“勇敢”的学生
 di一次课，他就收到了来自南安安“嚣张”的请假条：我有病，得治。
 第二次课，他竟然看到了三份写着南安安名字的随堂测试
 在姜铭愉快地扣掉她30分的平时分之前，南安安赶到了他办公室负荆请罪，总算挽回了差点跑走的分数。
 挽回分数的同时，南安安把自己沦陷在了男神导师深邃的眼眸中。
 男神只给她一个人辅导专业课，只让她一个人给他喂鱼，
 只按过她的脑袋，只载…..."
http://www.zhihu.com/topic/21132178/hot,你好，陌生人（书籍）,《你好，陌生人》以“遇见陌生人”为主题的旅行故事。在旅行路途中，我们看过美的风景，也遇到过各种各样的人，是他们让地图上的每一寸光阴都充满了旅行的意义，虽然，他们于旅行者，是有缘无份的陌生人。但这些故事需要被记录下来，因他们曾抵达我们心里的远方。18个旅行当中的陌生人，在世界的不同角落曾给过旅人无数的情愫。南非、巴黎、瑞士、日本、泰国、苏丹……背包客、渔夫、边境教师、修道士、厨师……旅行的意义不仅仅…...
http://www.zhihu.com/topic/21089201/hot,你好！植物（书籍）,《你好！植物》用轻松的风格介绍了近300种南北东西喜闻乐见的花草。通过故事或知识切入点介绍植物，包括大众误区，比如情人节的玫瑰，不是兰科却叫兰的很多常见植物；另外还有各种唤起城市的人们儿时乡村回忆的野果，桃金娘、地菍、悬钩子之类。通过这本书，你可以跟随植物达人的视线，由陌生到熟悉，一点点去认识花草，体会发现的乐趣。当你在游览的旅程中，如果认出身边的野生植物，那原本很普通的行程会变得更加有情趣，增添…...
http://www.zhihu.com/topic/21061238/hot,你好薇薇安（书籍）,一个女孩（薇薇安）因为深爱的人死了而陷入寂寞的回忆之中不能自拔，错把一个同名的人当自己的情感寄托，寄予对男友的牵挂。越深爱越寂寞，薇薇安的寂寞如黑洞，吸引着身边的人，同时自己也沉浸在黑洞中不能解脱。在这个过程中，温暖善良的咖啡店店长尼古拉和强悍精明的女编辑卢都对薇薇安产生了异样的好感……...
http://www.zhihu.com/topic/21012598/hot,你好，爱丽丝（书籍）,两个素未谋面的女孩相识于网络，因为彼此的文字惺惺相惜。经过岁...
http://www.zhihu.com/topic/20981601/hot,你好，真相！（书籍）,《你好，真相！：蒙冤者的告白和他们的故事》是《冤案何以发生：导致冤假错案的八大司法迷信》一书的姊妹篇，《冤案何以发生》讲述了一位美国检察总长对刑事司法制度的系统反思，《你好，真相！：蒙冤者的告白和他们的故事》则让那些无辜入狱的蒙冤者们一个一个走到台前，在聚光灯下发出他们自己的声音。全书以纪录片式的冷静直白和蒙冤者的自我讲述呈现他们的故事，并配以他们创作的艺术作品，展现蒙冤者在入狱前、监狱中及出狱…...
http://www.zhihu.com/topic/21176970/hot,你好，前任先生（书籍）,青涩腼腆的岁月里， 他们曾是羡煞旁人的少年情侣，热恋中他却不告而别，决绝消失。 五年后再度狭路相逢， 他是炙手可热的商界新贵，她是形象被黑、绯闻缠身的三流女演员。 林龄往酒店走了两步，邱嘉桥突然开口：“林小姐，我今天来这里，是专程来找你的。” 林龄一怔。 邱嘉桥一字一字极缓地说：“五年前，我有一件东西落在林小姐那里，一直没有机会取回来。不知道林小姐是否还替我留着。如果有机会的话，我想把那东西拿回来。”…...
http://www.zhihu.com/topic/21132397/hot,最初不过你好（书籍）,本书收入20个文风凛冽、自带匪气、关于情与爱的故事。故事里林林总总的小人物，看似各自东奔西突追逐着梦想、爱情、人生、信仰、认同……但终了，命运花开花落各自飘零。这些染上了青春颜色与气味的文字如同燃烧的火焰，漫天恣肆飞扬，明灭刹那间带您步入青春的殿堂。...
http://www.zhihu.com/topic/20153317/hot,你好，我叫多蕾丝（电影）,年逾花甲的多蕾丝仍旧有著一颗渴望爱情的少女心，在一场自助会中她遇到了年轻的白马王子！年龄不是问题，多蕾丝决定为了她的真爱展开追爱行动！...
http://www.zhihu.com/topic/20124228/hot,你好，法奈利（书籍）,14 岁的蒂芙阿尼•法奈利，出生于普通家庭，被势利的母亲送去...
http://www.zhihu.com/topic/20895896/hot,你好中国·问答 70 年（书籍）,岁生日，新华社联合知乎共同发起「你好中国·问答 70 年」活动。从不同领域、不同维度...
http://www.zhihu.com/topic/20095889/hot,遇见你之前（电影）,《遇见你之前》（Me Before You）是根据乔乔·莫伊...
http://www.zhihu.com/topic/20132707/hot,只想和你好好的（书籍）,那年夏天，知了声声，在学生会的面试上，纪思璇狡黠地看着乔裕，笑语盈盈地当众宣布：“你以后就是我的人了。”从此，两情缱绻，她的笑，胜却了满树繁花。 六年后，再度重逢，两个人玩棋盘游戏，乔裕忽然开口，“我们停战吧！”“哦，怎么停？”“依照历史惯例来吧？”“什么惯例？”“和亲。”说完，她便看到一枚戒指慢慢滑入左手无名指。他缓缓开口，“何以道殷勤？约指一双银。” 能让我微笑的事，是清晨柔和的日光，午后轻徐…...
http://www.zhihu.com/topic/21085198/hot,皇帝先生你好嗎？（书籍）,有人認為做皇帝最好， 也有人認為做皇帝最辛苦。 其實皇帝乃至皇子王公有時挺好，有時卻不怎樣好過。 像我們的生活一樣， 有快樂也有煩惱的一天。...
http://www.zhihu.com/topic/21042625/hot,你好，我是费曼（书籍）,《你好，我是费曼》是诺贝尔物理学奖得主理查德·费曼的自传式随笔。 费曼在参与“曼哈顿计划”时，成为开保险柜高手。 费曼在默数一二三时，发现了每个人大脑工作的方式截然不同。 费曼在得知自己获得诺贝尔奖时，抱怨没有人赞赏他的桑巴鼓技艺。 费曼在调查挑战者号失事时，靠一杯冰水、一个橡皮圈，打破了威权，还原了“挑战者号”失败的真相。 对费曼来说，这一生就像个孩子一样，好奇地寻找着前方的未知。他希望的，是想留…...
http://www.zhihu.com/topic/20699375/hot,你好！三公主（书籍）,“宇宙神奇女汉子” “武林二男侠客” 笑出八块腹肌 夯热血少年漫画 著名漫画家阿桂爆笑少年漫画作品 我们所在的地球是一颗在银河系中不停旋转的蓝色小行星，与浩瀚宇宙相比，小得好像太平洋里的一粒灰尘。武林元年，神秘的地外种族造访地球，留下了一段地球超二少年与宇宙超神女汉子据上古龙仙史料记载：龙仙族拥有地球远古传说中“龙”的原体，蕴藏着仿佛永不枯竭的能量，掌握无比先进的飞行技术，拥有人类外貌及姓名，通晓包…...
http://www.zhihu.com/topic/20720756/hot,你好！特雷西·桃子镇（书籍）,"《桃子镇》以小厨师尼莫和傲娇“镇猫”桃子的日常生活为主线，叙述着镇上一个个动人的故事。 
 曾独闯天涯的埃达小姐是餐厅的“常客一号”，大提琴师林先生只点什锦饭，X小姐从来都外带从不堂食，手作达人瑞比小姐曾经超讨厌胡萝卜……出现的每个角色都有属于他们的一道菜，而他们的背后的故事也如这些菜一般值得细细品味。或是做人小哲理、或是爱情小感悟，平静的生活小事里渗透着的点滴情感，在不经意间已走进读者心中。集世间…..."
http://www.zhihu.com/topic/20870360/hot,你好，我是爱因斯坦（书籍）,1954年3月的一个寻常日子，一个名叫咪咪的女孩误打误撞把电...
http://www.zhihu.com/topic/20107465/hot,我想和你好好的（电影）,《我想和你好好的》是由李蔚然执导，作业本担当编剧，冯绍峰、倪妮主演的爱情片...
http://www.zhihu.com/topic/20829314/hot,你好，请问几点打烊（书籍）,书里写了四位主人公，他们的故事各有不同，却又有所关联。有拼尽...
http://www.zhihu.com/topic/21043037/hot,你好，我是110（书籍）,"外甥打舅舅，起因是姥爷；包工头学校大骂女教师；猖狂“小三”街头耍泼妇；痴情男夜闯美容院；六旬老翁公交车上扮色狼……还有洗浴中心的尴尬女人、公园里的出走儿童、“天上掉下来的”大富婆、被锁在消防栓上的小轿车…… 
 现代都市，功利横行，人心浮躁，处处陷阱。一言不合就大打出手；各种伤害防不胜防；无处不在的骗局令你草木皆兵…… 
 有着8年警龄的110巡警杨天舵，白天穿行于都市里的大街小巷，深夜在日记里写尽人间冷…..."
http://www.zhihu.com/topic/21005349/hot,你好!特雷西:好天气（书籍）,你希望未来的自己，会成为怎样的人？你所期盼的爱人，会是怎样的模样？你所期待的每一个明天，都会是好天气吗？我们的期许，未必会被上天听到，却被特雷西胡用画笔用语言细细描绘，一箭穿心。10个独立的故事，10份不一样的心情。作者从平时对生活的观察中总结感悟，道出人们心中无法言喻的心情。关于“自我”：世界所定义的林林总总，我们不必一一遵循。每个人的花园，都自有花开，芬芳甜美。关于“爱人”：遇上对的人，和彼此一…...
http://www.zhihu.com/topic/21006400/hot,你好，睡了吗（书籍）,"《你好，睡了吗》是新浪微博超人气作者@粽粽粽粽粽粽粽 的暖心图文作品集，200页可以随意翻开阅读的晚安集，帮你重新发现藏在每个角落的心事和欢乐。一个个脑洞，一点点温暖，一些些浪漫，一丢丢惆怅，心事装得下整个宇宙的夜晚，伴你入眠。 
 
一条游入你脑海的小鲸鱼，ta有时是聆听你心意的听诊器，有时是温柔的獠牙，有时是一颗找不到方向小行星，有时是一个吻…… 
 
这是一本适合睡前阅读的小书。 
愿你在这个百无聊赖的夜…..."
http://www.zhihu.com/topic/20961309/hot,亲爱的我，你好吗（书籍）,从灵魂的故乡出发，向前走，穿越黑暗与光亮、欢笑与泪水，历经毛虫破茧般的细碎疼痛，抵达生命中的一个个站台。从出生到死亡，用一生行走，不曾停歇。 《亲爱的我，你好吗》撷取有关成长感悟的美文杰作，涵盖少年残像、青涩时光、校园生活、成长感伤等内容，散发着既甜美又忧伤的青春味道。...
http://www.zhihu.com/topic/21009747/hot,你好，我的子宫（书籍）,你的子宫还好吗？《你好，我的子宫》是为所有女性而写，同时也是为那些爱老婆的男人而写。这不仅是一本实用的女性健康书，也是一本随笔和启示录。笔者专业而生动的文字，再加上有趣的插画，让本书读起来比其他健康类书籍更有意思。《你好，我的子宫》以子宫为中心，讲述了女性从头到脚必须知道的健康问题，从月经、性生活、怀孕、分娩到闭经，与子宫类疾病相关的头疼、忧郁症、肥胖、脱发、甲状腺问题也囊括其中，甚至还涉及男性…...
http://www.zhihu.com/topic/20135721/hot,你好，先生（知乎电子书·盐）,唐僧同志，资深 HR。唐僧同志是知乎第 61485 个用户，...
http://www.zhihu.com/topic/20153459/hot,你好我的爱（电影）,"浩婷（赵安 饰）和男友元在（闵锡 饰）相恋多年，两人感情一直十分要好，如今，元在在法国学习深造，浩婷只等他一回国，两人便准备完婚。然而，当元在重新回到浩婷的身边时，浩婷却发现他有了一丝怪异和陌生。
原来，在法国学习期间，元在结识了名为东华（梁银容 饰）的男子，两人相处久了，竟然产生了跨越了性别的恋情。得知此事的浩婷心痛欲绝，她怎么也无法接受，自己竟然被一个男人打败了。然而，浩婷锲而不舍的性格并没有让…..."
http://www.zhihu.com/topic/20860424/hot,你好，这是地球吗？（书籍）,《你好，这是地球吗？》是一本从太空拍摄地球的科普摄影集。 书名源自作者英国功勋宇航员蒂姆•皮克在太空中误拨的一通电话...
http://www.zhihu.com/topic/20069326/hot,我们的挑战（综艺节目）,《我们的挑战》是江苏卫视推出的一档大型户外明星挑战类真人秀节...
http://www.zhihu.com/topic/20103491/hot,开心家族（电影）,《开心家族》是由金英卓编导，车太贤、高昌锡、张英南、李文秀、...
http://www.zhihu.com/topic/20104009/hot,你好生活家第2季,《你好生活家第2季》是浙江卫视推出的实景生活馆“生活方式分享秀”...
http://www.zhihu.com/topic/21080346/hot,你好，旧时光：漫画版1（书籍）,《你好，旧时光》，给每个人的成长之书。八月长安原著，携手享誉国际的漫画家golo，打造梦一般绚烂的时光之旅。每个人的童年都是美好的，这本书能够让你重回美好时光，温习那些童年瑰丽的幻想。一代又一代人，生命就像往复的陀螺，兜兜转转。愿每一个人，都能珍惜过去的伙伴和曾经的旧时光。一部画给每个人的青春纪念册。余周周是一个出生在八十年代末的普通小姑娘，和妈妈相依为命，在漫长孤寂的童年中，好的朋友叫奔奔。进入小…...
http://www.zhihu.com/topic/20874357/hot,你好，有故事的陌生人（书籍）,在淘宝上有一家特殊的店铺——“CY故事”，它主打的宝贝为一个...
http://www.zhihu.com/topic/21074093/hot,我就要你好好的（书籍）,《我就要你好好的》是2012全英最高人气小说——活得好，是对生活最大的报复！你可以把生活变成故事，但你想不到故事的结局！ 露·克拉克知道很多事情。她知道从公共汽车站走回家有多少步。她知道她喜欢在“黄油面包”茶馆工作，喜欢这有点迷糊又有点窘迫的生活。她其实清楚地知道自己或许不喜欢男朋友帕特里克。 露不知道的是她马上要失去她的工作，即将发生的事情会让她猝不及防。 威尔·特雷纳知道摩托车事故带走了本可以波澜…...
http://www.zhihu.com/topic/21011566/hot,你好，旧时光：漫画版2（书籍）,"《你好，旧时光》，给每个人的成长之书。
 八月长安原著，携手享誉国际的漫画家golo，打造梦一般绚烂的时光之旅。
 在小学生年代“我再也不跟你玩了“，这句话的杀伤力，不亚于“我跟你绝交了”。
 小学生口中的“×××喜欢×××”，又怎么可能会是真正的喜欢呢？
 但可以肯定的是，无论什么时候，林杨都永远会守护在余周周身边。
 余周周的小学生活并不那么如意，自己的身世被人知晓，zui亲密的伙伴不再和自己一起回家……但…..."
http://www.zhihu.com/topic/21079050/hot,你好！特雷西·对的人（书籍）,你找到那位“对的人”了吗？ 奔走在繁复的生活中，一点小事儿便会让疲惫的心浮躁不安。迷茫彷徨中，总是很希望身边有个人可以依赖。这个“人”，是亲人，是良朋，亦或是伴侣。《对的人》为你洗去心上的灰霾，看清方向，找到那位“对的人”。 《你好！特雷西·对的人》共收录11个完全独立的绘本故事。故事主要为作者本人对生活的观察与感悟，内容恰如其名，都是一些小事见真理，在小生活中找到命定之人的经历。 相关视频请点击：...
http://www.zhihu.com/topic/21132099/hot,只想和你好好在一起（书籍）,被男友与闺蜜联合背叛，秦雨飞伤心至极，不肯轻易再谈爱，不想却偏偏又对温柔多情的顾英杰动了心。 顾英杰眉目清朗，笑着告白：“我对每段感情都是认真的。” 认真才怪！秦雨飞只觉得自己对他越来越认真。真是糟糕！ 不正确的感情就要快刀斩乱麻，她与他约定，删掉彼此的联络方式，不再联系，不再见面。 顾英杰却说：“这次我依你。若下次我们再见，如果你还爱我，还用这样的眼神看我，那我们就必须在一起！” 自此，秦雨飞开始…...
http://www.zhihu.com/topic/21132165/hot,你好，我的傲慢绅士（书籍）,她在异乡流浪，想方设法让自己好好活着，像一只小型猫科动物，善于伪装，表面可爱，尖牙锋利。 他是有点不太正常癖好的英国大贵族，想要养一只听话乖巧的小猫咪，却不小心把一头会装乖的狡猾小狐狸给带回了家。 表面衣冠楚楚，背地里掌控欲爆棚、高高在上的变态贵族遇上表面乖巧听话，背地里比他阴险理智的宠物，无声的硝烟开始弥漫。 从此，家里每天都在上演主人与宠物之间斗智斗勇，诱惑与反诱惑的拉力战。...
http://www.zhihu.com/topic/20868950/hot,你好，我亲爱的陌生人（书籍）,我们会献上最自然的微笑和拥抱，说一句：你好，我亲爱的陌生人。...
http://www.zhihu.com/topic/21158236/hot,你好吗？我很想你（书籍）,《你好吗？我很想你：许多许多年前的老情书》收集了民国时期刊登在报刊杂志上的119封情书，多是一来一往、互相应答的信件。这些情信的书写者，多以普通的城市青年男女为主，其中既有正值青涩年华的在校学生，也有正处于婚恋年龄，自主谋生的公司职员、学校教师等。这些普通男女间互诉衷肠的信函，这些个体生命的低语微叹、爱恨离愁，构成了一个时代无法忽视的情感记忆。 《你好吗？我很想你：许多许多年前的老情书》同时也收集了…...
http://www.zhihu.com/topic/21093601/hot,你好！我是韩国人！（书籍）,《你好!我是韩国人》作者想告诉你们“韩国人心中的中国和中国人”，语法肯定会常常错。如果没有错就奇怪了，那就是外国人...作者说：我叫张远永，我是25岁的韩国留学生才是大学三年级。快点努力学习，要找中国女朋友，中国好，这里就是对我来说合适的国家……...
http://www.zhihu.com/topic/21201020/hot,你好，劝退师小姐（手机游戏）,《你好，劝退师小姐》（原名：颤抖吧，小三）是一款角色扮演类型的橙光现代游戏。...
http://www.zhihu.com/topic/21003210/hot,你好，有故事的人（书籍）,一个“卖故事的小女孩” 淘宝有一家特殊的小店——“CY故事”，主打宝贝为一个个真实的原创故事，故事完整地写在宝贝详情中，读完觉得喜欢自愿拍下，这种独特的经营方式引来众多追随者，到目前为止小店已经有了400个故事，百万点击量，有五万多人为故事买单，国内近百家多家媒体相继报道。 现实版“一千零一夜” 这是一本真实记录小人物喜怒哀乐的故事集——水客妈妈用两万斤奶粉换一个包、年过七旬的奶奶花一辈子寻找自己的父亲…...
http://www.zhihu.com/topic/20136963/hot,你好，门捷列夫（知乎电子书·一小时）,如今我们打开元素周期表可以清晰地看到，从序号为 1 的氢元素...
http://www.zhihu.com/topic/20213333/hot,回首又见他（日剧）,从美国堪萨斯州载誉归来的医生石川玄（石黒賢 饰）受聘进入天真楼医院，但映入眼帘的并非医生救死扶伤的场面，而是当班医生缺席失职、病患无人照顾的混乱场景。尤其不能让他忍受的是，天真楼的当家外科医生司马江太郎（織田裕二 饰）丝毫没有医者全力医治患者的责任心。司马决不在下班后继续参与抢救工作，却可为了客观的报酬抢救议员的儿子；他和医疗器械商人关系暧昧，互通利益。最令石川气恼的，司马简直“视患者的生命如草芥…...
http://www.zhihu.com/topic/20733977/hot,你好!数学.第二辑 最亲切的数学概念启蒙图画书（书籍）,用眼睛认识熟悉球形模样、圆柱模样、箱子模样的立体图形，了解各立体图形的特性。通过西瓜星、罐桶星、箱子星上生活的三个王子陷入巫婆的圈套，相互吵架又和解的有趣故事，让孩子愉快地了解立体图形的名称和特性。 《你好！数学·最亲切的数学概念启蒙图画书：忧虑虫，麦尔龙（第2阶段）》 学习运用直接对比方法来比较事物的长度和高度。 通过忧虑虫麦尔龙直接比较身高、高度、距离的有趣故事，让孩子们学习了直接比较长度的方法…...
http://www.zhihu.com/topic/20209569/hot,我和X先生 第二季（电视剧）,我和X先生由blued交友软件联合有个微电影工作室联合出品。第一季一经推出便取得广泛关注好评~历经半年的等待，第二季《只为遇见你》火热来袭！作为国内首部同志连续剧，将会带给大家怎样的惊喜呢——我叫徐正熙，2008年，我爱上了自己的好兄弟，却没想到之后他竟然.......
http://www.zhihu.com/topic/20673380/hot,你好生活家 第二季（综艺）,众所期待的国内首档实景人生分享秀《你好!生活家》第二季即将重磅回归，于9月23日起每周日晚22:00在浙江卫视播出...
http://www.zhihu.com/topic/20147944/hot,哥哥我爱你（电影）,九岁的张韩一是个调皮的孩子。他总是在学校里捣乱，经常逃课。而十二岁的张韩星则是一个懂事的哥哥，他经常帮助弟弟。兄弟俩一个好动，一个喜静，性格迥然不同。但他们的关系非常好。 韩星经常头痛，直到有一天病倒了。去医院检查才发现，韩星得了脑癌。妈妈和爸爸知道这个消息之后非常震惊。医生还说，动手术会破坏视觉神经，韩星会因此而失明。父 母都为没有早发现儿子的病感到内疚，也为儿子的将来担忧。他们把所有的精力都放…...
http://www.zhihu.com/topic/20157843/hot,我爱红娘（电影）,十九世纪末的美国纽约，精明、干练、泼辣的媒婆Dolly一心一意想为富翁Vandergelder作媒，结果却促成了自己与富翁的婚姻，同时，也撮合了富翁的两个伙计与女帽商及助手、富翁侄女与艺术家的婚事。...
http://www.zhihu.com/topic/21085308/hot,你好!法语-1-学生用书-A1（书籍）,《你好！法语（1）（学生用书）》为你贴心设计的教材： ★以“欧洲语言共同参考框架”的学习规范为指导，一至三册分别对应A1、 A2、B1三个级别。 ★细致周到的“本土化”：增设语音单元，并与全书语音学习相呼应；语法讲解充分考虑各类考试——大学法语四级、考研二外法语、TCF/TEF/DELF等的需求，按照中国读者的接受习惯进行总结梳理； 单词与课文、练习紧密结合，提供单词读音的网络下载，总词汇表以中英双语释义，帮助单词的…...
http://www.zhihu.com/topic/20111759/hot,狐狸与我（电影）,一个十岁的小女孩（贝蒂·若耶-布萝 饰）在上学路上碰见了一只正抓田鼠的狐狸。女孩被漂亮的狐狸迷住，下学后回到森林原地希望再见到那只狐狸。从秋天到冬天，女孩在厚雪地里沿着狐狸的脚印寻找，却失足摔断了腿，整个冬天只好在室内度过，读了很多关于狐狸的书。春天是猎狐的季节，为狐狸忧心忡忡的小女孩欣喜若狂的发现了狐狸的洞穴和它的三只小狐狸，却没想到狐狸嗅出人的气味，连夜转移了幼崽。女孩决定不去打扰狐狸，而是坐…...
http://www.zhihu.com/topic/20989168/hot,你好，我是阿斯伯格女孩（书籍）,《你好，我是阿斯伯格女孩》是阿斯女的必备手册。阿斯伯格综合征是孤独症谱系中程度较轻的一种。作者本身即是一个阿斯女，对阿斯女在个人生活、职业、友谊、婚姻、养育孩子等方面遇到的种种问题，给出了实用性的建议；从早期到成年，从身体到情感等各方面都有涉及。如果你是个阿斯女，或者你怀疑自己是却还没有得到诊断，《你好，我是阿斯伯格女孩》将帮助你加了解自己；对专业医疗和心理辅导执业人员，以及阿斯女父母和所爱的人…...
http://www.zhihu.com/topic/21168698/hot,你好，我是阿斯伯格员工（书籍）,阿斯伯格综合征人群，是一个比孤独症人士更普遍但更没有受到关注的人群。他们往往显得不合于俗而孤独。但他们有着趣味盎然、与众不同的内心世界，更有属于自己的才赋和能力。然而阿斯伯格的障碍会让他们在职场遭遇各种阻碍，甚至找工作都困难重重。 本书探讨这个人群在职场遇到的问题并给出各种实用建议。一方面以阿斯伯格人群的视角切人，帮助他们理解职场，学会如何扬长避短，解决社交困境；另一方面，也帮助老板和阿斯伯格的…...
