url,title,description
http://www.zhihu.com/topic/21043130/hot,你好，孩子：爱与被爱的故事（书籍）,纪实摄影是摄影师长期关注，并对题材进行了深入采访而拍摄的有着社会学意义和历史文化意义的图片。相对于报道报影而言，纪实摄影不太讲求时效性和新闻性，它的影响是长时期的。纪实摄影的目的不只是向人讲述一个故事，它同时还能揭出这个故事的丰富背景，更注重表现被摄体的内在精神。...
http://www.zhihu.com/topic/20862739/hot,对的人，终将把你好好爱着（书籍）,我们曾相爱，那么美好的时光，以为可以携手一生，终敌不过岁月的...
http://www.zhihu.com/topic/20257023/hot,北京青春你好文化传媒有限公司,北京青春你好文化传媒有限公司以精锐人才为先导，以剧本创意及原创研发为核心竞争力，以丰厚的影视制作项目管理经验为保障，是一家覆盖制作、宣传、发行、艺人经纪等影视制作全产业链的文化传媒公司。青春你好坚守精品追求，汇聚精英团队，融合市场导向，追求国际品格，旨在打造兼具市场效益和社会口碑的影视精品杰作。公司下设创意研发部、制作部、项目运营部、宣传部、艺人经纪等部门，可胜任不同题材、不同类型、不同播映平台…...
http://www.zhihu.com/topic/21164059/hot,我想和你好好的（书籍）,"那年，她十八岁，被亲情、爱情、友情同时背叛，甚至不得不离开生她养她的城市。一个人，一只猫，一个背包，独自踏上背井离乡的路，在流浪中舔舐着结疤的伤口。
 九年后，那只陪伴多年的狸猫老死了，她重新踏上故土，替母亲回来做一个告别，却意外发现了九年前她被迫离开的真相，陡然掀起的商战让她的爱人一夕之间家破人亡不得不与夏家政商联姻来挽救家业，抽丝剥茧露出的真相让她发现了自己被隐藏了二十多年的真实身世。
 面对闺…..."
http://www.zhihu.com/topic/20862946/hot,你好，神：一个精神分裂症患者的自我救赎笔记（书籍）,这本书首先是一本更新换代型的《老子》读本。作者结合*的考古材...
http://www.zhihu.com/topic/20868941/hot,你好！三公主：龙仙传.第4卷（书籍）,前情回顾： 平凡男孩桂小云不过是吃了颗特大号鱼丸，谁知怪事连...
http://www.zhihu.com/topic/20881816/hot,你好！三公主：龙仙传.第 4 卷（白金卷）（书籍）,我们所在的地球是一颗在银河系中不停旋转的蓝色小行星，与浩瀚宇...
http://www.zhihu.com/topic/20868932/hot,你好！三公主：龙仙传.第2卷（书籍）,宇宙最神女汉子 武林最二男侠客笑出八块腹肌 最夯热血少年漫画...
http://www.zhihu.com/topic/20872362/hot,你好！三公主：龙仙传.第 6 卷（书籍）,前情回顾：平凡男孩桂小云误食上古龙珠后，开始了一系列变化。从...
http://www.zhihu.com/topic/20868945/hot,你好！三公主：龙仙传.第5卷（书籍）,前情回顾：平凡男孩桂小云不过是吃了颗特大号鱼丸，谁知怪事连连...
http://www.zhihu.com/topic/20881815/hot,你好！三公主：龙仙传.第 2 卷（白金卷）（书籍）,在第 4 卷中，为了变回男身，桂小云被迫与九尾蚺精立契比武，...
http://www.zhihu.com/topic/20828826/hot,我想和你好好的：给年轻人的亲密关系成长课（书籍）,本书在汲取发展心理学、精神分析、家庭治疗等领域最新研究成果的...
http://www.zhihu.com/topic/20867816/hot,你好！三公主：龙仙传.第1卷（白金卷）（书籍）,我们所在的地球是一颗在银河系中不停旋转的蓝色小行星，与浩瀚宇...
http://www.zhihu.com/topic/20881821/hot,你好！三公主：龙仙传.第 3 卷（白金卷）（书籍）,我们所在的地球是一颗在银河系中不停旋转的蓝色小行星，与浩瀚宇...
http://www.zhihu.com/topic/20868936/hot,你好！三公主：龙仙传.第3卷（书籍）,我们所在的地球是一颗在银河系中不停旋转的蓝色小行星，与浩瀚宇...
http://www.zhihu.com/topic/20876723/hot,你好啊！乔乔 写给爸妈的儿童摄影书（全彩）（书籍）,这是一本最完整的儿童摄影宝典和教科书！有心、有趣、有用。 图...
http://www.zhihu.com/topic/20003423/hot,八月长安,八月长安出版了第一本长篇青春小说《你好，旧时光》，此后又推出了同系列图书《暗恋·橘生淮南》、《最好的我们》...
http://www.zhihu.com/topic/20087897/hot,倪妮（演员）,随后主演爱情悬疑电影《杀戒》、爱情电影《我想和你好好的》及治愈系电影《等风来》...
http://www.zhihu.com/topic/19584118/hot,知乎吉祥物,喜好：冰钓、海钓 初登场： 你好，我叫刘看山。 - 知识青年...
http://www.zhihu.com/topic/20058342/hot,万茜（演员）,凭借电影《军中乐园》获得第51届台湾电影金马奖“最佳女配角”。2017年凭借《你好，疯子！》获得第24届北京大学生电影节最佳女演员奖...
http://www.zhihu.com/topic/19578870/hot,王自健,在喜剧电影《你好，疯子！》中饰演马睿；同年，凭借电影《你好，疯子！》获得“第8届澳门国际电影节”最佳男配角奖的提名...
http://www.zhihu.com/topic/19755064/hot,陶喆,2013年发行创作专辑《再见你好吗》。2015年制作并演唱歌曲《请到长城来滑雪》...
http://www.zhihu.com/topic/20032213/hot,王晓晨,主演情感温馨剧《大好时光》和青春励志剧《你好乔安》。2016年4月，主演都市爱情轻喜剧《我的...
http://www.zhihu.com/topic/19894974/hot,范玮琪,2009年，凭借歌曲《想知道现在你好不好》获得“第七届东南劲爆音乐榜”劲爆十大金曲奖...
http://www.zhihu.com/topic/20139870/hot,南烟斋笔录（电视剧）,剧合影视、娱跃文化、星源天华、新浪微博、天道至善、大声娱乐、青春你好、森宇等出品的民国传奇剧，由刘海波和叶昭仪执导...
http://www.zhihu.com/topic/20031835/hot,王祖蓝（演员）,参加湖南卫视明星模仿秀大赏赛《百变大咖秀》。2014年参演《老表，你好hea!》。2014年，王祖蓝加盟综艺节目《奔跑吧兄弟》并主演电影版...
http://www.zhihu.com/topic/20136045/hot,古代人的日常生活（知乎周刊）,「你好呀，古代人！」 这本书差不多就是这样，让你轻松地——不需要任何历史知识...
http://www.zhihu.com/topic/20063093/hot,王菀之,领衔主演的首部电视剧《老表，你好嘢！》播出。2014年10月...
http://www.zhihu.com/topic/19978669/hot,罗文（歌手）,凭借与甄妮合唱电视剧《射雕英雄传》的主题曲《铁血丹心》以及《世间始终你好》获得关注。1986年，凭借歌曲《几许风雨》获得第4届十大劲歌金曲奖以及第9届十大中文金曲奖...
http://www.zhihu.com/topic/20136032/hot,上班族 24 小时健康指南（知乎周刊）,眼科医生教你正确佩戴隐形眼镜，皮肤科医生指导你好好洗个澡，消化科医生告诉你吃早饭到底有多重要...
http://www.zhihu.com/topic/20058314/hot,张继聪,同年，主演TVB时装喜剧《老表，你好嘢！》。2013年，获得第35届“十大中文金曲”全年最佳进步奖铜奖...
http://www.zhihu.com/topic/20051088/hot,陈建州,2011年，主演贺岁微电影《你好吗。我很好》。2012年，担任容祖儿《雾里看花》的MV男主角...
http://www.zhihu.com/topic/20885136/hot,杨冰阳情感两性精选集（共 3 册）（书籍）,却迟迟不肯主动走入婚姻？虽然嘴上对你好，对你花钱却不那么大方？看起来毫不相关的问题...
http://www.zhihu.com/topic/20855112/hot,书旅人（书籍）,裴维尔的歌——你能讲出秘密，又不会泄露自己。你好，安娜·卡列尼娜——我不刻意要做一个旅行者...
http://www.zhihu.com/topic/20921299/hot,再见，吾爱（书籍）,他只是爱她， 但是爱人…… “你好啊，宝贝儿，好久不见。”...
http://www.zhihu.com/topic/20845809/hot,疯了！桂宝.20，有志卷（书籍）,同时还出版全新少年励志漫画《你好！三公主》系列。阿桂被全国二十多所学校聘为“荣誉校外辅导员”...
http://www.zhihu.com/topic/20845791/hot,疯了！桂宝.13，如意卷（书籍）,还有着大家熟悉又陌生的强大生物……最令桂圆们惊喜的是，阿桂哥最新少年漫画《你好！三公主》也在书中惊艳亮相！还有许多神秘惊喜...
http://www.zhihu.com/topic/20924239/hot,小创客趣玩microbit开发板编程（书籍）,以使用MakeCode编辑器完成一个完整的micro：bit项目为终，涵盖你好世界、闪烁……...
http://www.zhihu.com/topic/20888300/hot,孵化皮克斯：从艺术乌托邦到创意帝国的非凡之旅（书籍）,「你好，是劳伦斯吗？」电话那头问道，「我是史蒂夫•乔布斯。几年前...
http://www.zhihu.com/topic/20845792/hot,疯了！桂宝.14，电影卷（书籍）,还有更令桂圆们惊喜的阿桂哥最新少年漫画《你好！三公主》连载！可爱到爆炸的小小礼品...
http://www.zhihu.com/topic/21199042/hot,跟小楼老师学用Axure RP 9——玩转产品原型设计（书籍,并介绍多个独特的方法和技巧提升原型设计工作的效率与质量。全书共7章，包括：你好，Axure RP 9！、上手Axure...
http://www.zhihu.com/topic/20842140/hot,深深的爱，浅浅的说（书籍）,也别总是对他人要求太多，不要让那些真正对你好的人，慢慢的从你的生活中消失...
